MODEL,CONSTRUCTION_LEVEL,DATE END,REMARKS,NQ,COST CENTER,PNR,TYPE_AUDIT_DESC,PART_DESC,SFARTNR,TURN,Cluster,REMARKS_Column1_Similarity
RWD,Serie,8-Feb-23,Left side parking brake cable not routed through bracket.,3,MARST4,93624930,CPA,"Brake cable, rear, left, parking brake",13,C,Left side parking brake cable not routed through bracket.,1
RWD,Serie,8-Feb-23,Rear inside left door missing a spreader rivet.,3,TR2ST5,93638914,CPA,"Rear-end door, left",C7,C,Rear inside left door missing a spreader rivet.,1
RWD,Serie,24-Feb-23,Fan switch on automatic air conditioning unit is loose.  No loss of function.,3,Supply,93661502,CPA,"Operating unit, automatic air conditioning",38,C,Fan switch on automatic air conditioning unit is loose.  No loss of function.,1
RWD,Serie,6-Feb-23,Underride guard plugs missing on left and right side.,3,TR2ST7,93628220,CPA,"Underride guard, side, left",C7,C,Underride guard plugs missing on left and right side.,1
RWD,Serie,27-Sep-23,"Tire pressure is not printed correctly, print not aligned properly.",3,DYNST1,93899763,CPA,"Information label, tire pressure/tire size",00D,,"Tire pressure is not printed correctly, print not aligned properly.",1
RWD,Serie,27-Sep-23,Left side lower section of the instrument panel is missing push pin.,3,TR3ST7,93899763,CPA,"Lower section, instrument panel",C7C,,Left side lower section of the instrument panel is missing push pin.,1
RWD,Serie,27-Sep-23,Lower sliding door carriage adjusted too low.  Carriage makes contact with door seal on body.,3,SLAST5,93899763,CPA,"Carriage, lower, sliding door, right",FV,,Lower sliding door carriage adjusted too low.  Carriage makes contact with door seal on body.,1
RWD,Serie,27-Sep-23,Rework visible on T77 grab handle in cargo area.,3,RWKST1,93899763,CPA,"Grab handle, entrance, sliding door, right",K7D,,Rework visible on T77 grab handle in cargo area.,1
RWD,Serie,27-Sep-23,Right side engine hood grommet missing.,3,TR2ST1,93899763,CPA,"Engine hood, inner",C7T,,Right side engine hood grommet missing.,1
RWD,Serie,27-Sep-23,Sika seal on right side D-pillar to sidewall not applied properly.,3,SIKAAUT,93899763,CPA,D-pillar,76A,,Sika seal on right side D-pillar to sidewall not applied properly.,1
RWD,Serie,28-Sep-23,Rear inside right sidewall fastener not installed properly.,3,TR3ST4,93908945,CPA,"Sidewall, right, inner",421,,Rear inside right sidewall fastener not installed properly.,1
RWD,Serie,21-Sep-23,Purge line making contact with ECU on engine.,3,CHAST4,93884252,CPA,"Line, activated charcoal canister, purge valve",221,,Purge line making contact with ECU on engine.,1
RWD,Serie,21-Sep-23,"Sliding door upper guide rail drip molding, A9106970500, missing.",3,TR2ST2,93884252,CPA,"Sliding door, right",C7T,,"Sliding door upper guide rail drip molding, A9106970500, missing.",1
RWD,Serie,21-Sep-23,Left side headlight not flush with fender.  Headlight is also making contact with fender at bottom of headlight.,3,CHAST6,93884252,CPA,Headlamp unit left,42,,Left side headlight not flush with fender.  Headlight is also making contact with fender at bottom of headlight.,1
RWD,Serie,11-Sep-23,Sharp weld fault on rear inside right D-pillar.,3,Z2SINNRH,93873040,CPA,D-pillar,423,,Sharp weld fault on rear inside right D-pillar.,1
RWD,Serie,11-Sep-23,Front right seat cushion material damaged.,3,,93873040,CPA,"Cover, seat cushion front right",991,,Front right seat cushion material damaged.,1
RWD,Serie,21-Sep-23,Front right seat wiring harness bracket is broken,3,TR4ST8,93872034,CPA,"Front seat, right",06,,Front right seat wiring harness bracket is broken,1
RWD,Serie,18-Sep-23,ECU harness not clipped to bracket.,3,CHAST4,93881217,CPA,Engine harness,38,,ECU harness not clipped to bracket.,1
RWD,Serie,18-Sep-23,Sliding door contact rubber boot flushness not ok.,3,SDPA,93881217,CPA,"Sliding door, right",42U,,Sliding door contact rubber boot flushness not ok.,1
RWD,Serie,14-Sep-23,Dent in at left B-pillar.,3,,93883833,CPA,"B-pillar, left",I2,,Dent in at left B-pillar.,1
RWD,Serie,13-Sep-23,x2 painted servo screws were not swapped out for unpainted servo screws.,3,TR2ST2,93879088,CPA,"C-pillar, right, inner",99E,,x2 painted servo screws were not swapped out for unpainted servo screws.,1
RWD,Serie,13-Sep-23,Incorrect sliding door push pin installed.,3,TR3ST2,93879088,CPA,"Sliding door, right, inner",C8,,Incorrect sliding door push pin installed.,1
RWD,Serie,13-Sep-23,Front right door seal is not flush.,3,RWKST1,93879088,CPA,"Seal, front door, right",42U,,Front right door seal is not flush.,1
RWD,Serie,12-Sep-23,Rear left door va panel missing push pin.,3,TR4ST7,93887420,CPA,"Door trim, rear-end door, left, lower",C7,,Rear left door va panel missing push pin.,1
RWD,Serie,12-Sep-23,Def hose on the right side of the underbody is not connected.,3,CHAST2,93887420,CPA,AdBlue(R),C77,,Def hose on the right side of the underbody is not connected.,1
RWD,Serie,12-Sep-23,Sika poorly tooled on right side D-pillar.,3,SIKAAUT,93887420,CPA,D-pillar,99E,,Sika poorly tooled on right side D-pillar.,1
RWD,Serie,6-Sep-23,Bottom of right side B-pillar trim missing swivel seat label.,3,TR4ST8,93862993,CPA,Information label,C7,,Bottom of right side B-pillar trim missing swivel seat label.,1
RWD,Serie,6-Sep-23,ECU harness not clipped to bracket.,3,CHAST4,93862993,CPA,Engine harness,38,,ECU harness not clipped to bracket.,1
RWD,Serie,6-Sep-23,Dent on rear left door below emblem.,3,Z3REDOOR,93862993,CPA,"Rear-end door, left",I2,,Dent on rear left door below emblem.,1
RWD,Serie,1-Sep-23,Left rear brake line making contact with leaf spring u bolt.,3,RAAST1,93865178,CPA,"Brake line, rear axle, left",221,,Left rear brake line making contact with leaf spring u bolt.,1
RWD,Serie,1-Sep-23,Right rear brake line not routed correctly and contacting the leaf spring u bolt.,3,RAAST1,93865178,CPA,"Brake line, rear axle, right",13,,Right rear brake line not routed correctly and contacting the leaf spring u bolt.,1
RWD,Serie,1-Sep-23,Underbody sidewall and body plug missing.,3,TR2ST7,93865178,CPA,Grommet,C7T,,Underbody sidewall and body plug missing.,1
RWD,Serie,8-Sep-23,Left side rear bumper is missing a pushpin.,3,TR4ST6,93868529,CPA,Bumper end piece,C7,,Left side rear bumper is missing a pushpin.,1
RWD,Serie,8-Sep-23,Front right airbag cover not flush with instrument panel.,3,PACST2,93868529,CPA,"Cover, front passenger airbag",42U,,Front right airbag cover not flush with instrument panel.,1
RWD,Serie,8-Sep-23,Missing swivel label  on the instrument panel on the  right side.  A447 817 2703,3,SLAST3,93868529,CPA,Information label,C7,,Missing swivel label  on the instrument panel on the  right side.  A447 817 2703,1
RWD,Serie,8-Sep-23,ECU harness  not secured along the left side of the frame.,3,CHAST4,93868529,CPA,Engine harness,C77,,ECU harness  not secured along the left side of the frame.,1
RWD,Serie,28-Aug-23,Weld splatter in multiple areas on left side cargo wall.,3,Z2SINNLH,93872380,CPA,"Sidewall, left, inner",423,,Weld splatter in multiple areas on left side cargo wall.,1
RWD,Serie,25-Aug-23,12V socket not installed properly in left side D-pillar in cargo area.,3,TR4ST7,93859981,CPA,"Socket, cargo area, 12V",42V,,12V socket not installed properly in left side D-pillar in cargo area.,1
RWD,Serie,22-Aug-23,Two clips missing from left sidewall protective strip causing leak during rain test.,3,TR4ST6,93855633,CPA,"Protective strip, sidewall, left",C7C,,Two clips missing from left sidewall protective strip causing leak during rain test.,1
RWD,Serie,22-Aug-23,Weld splatter in multiple areas on left side cargo wall.,3,Z2SINNLH,93855633,CPA,"Sidewall, left, inner",423,,Weld splatter in multiple areas on left side cargo wall.,1
RWD,Serie,22-Aug-23,Incorrect ignition start/stop switch installed.,3,,93855633,CPA,"Switch, ECO start/stop function",C8,,Incorrect ignition start/stop switch installed.,1
RWD,Serie,10-Aug-23,Def hose on the right side of the underbody is not connected.,3,CHAST2,93842904,CPA,AdBlue(R),C77,,Def hose on the right side of the underbody is not connected.,1
RWD,Serie,14-Aug-23,Washer hose not properly connected to the reservoir.,3,CHAST5,93852515,CPA,"Hose, windshield washer system left",C77,,Washer hose not properly connected to the reservoir.,1
RWD,Serie,10-Aug-23,Sharp weld splatter interior left sidewall.,3,Z2SINNLH,93842904,CPA,"Sidewall, left, inner",423,,Sharp weld splatter interior left sidewall.,1
RWD,Serie,8-Aug-23,Catalytic converter to exhaust bracket nut loose.,3,EPAST4,93820819,CPA,"Bracket, catalytic converter/primary catalytic converter",38,,Catalytic converter to exhaust bracket nut loose.,1
RWD,Serie,8-Aug-23,ECU harness gator clip not secured to engine bracket.,3,CHAST4,93820819,CPA,Engine harness,C77,,ECU harness gator clip not secured to engine bracket.,1
RWD,Serie,4-Aug-23,Left rear door adjustment not ok.  Gap to roof too large.  Left rear door does not line up with right rear door.,3,FINST1,93828358,CPA,"Rear-end door, left",61G,,Left rear door adjustment not ok.  Gap to roof too large.  Left rear door does not line up with right rear door.,1
RWD,Serie,4-Aug-23,DEF line too close to exhaust catalytic converter.,3,CHAST4,93828358,CPA,"Line, AdBlue(R)",42,,DEF line too close to exhaust catalytic converter.,1
RWD,Serie,4-Aug-23,Right side D-pillar poorly fitting at bottom of D-pillar causing fitment issues with right side taillight and right side rear bumper end piece to rear door.,3,Z2SCOMRH,93828358,CPA,D-pillar,42,,Right side D-pillar poorly fitting at bottom of D-pillar causing fitment issues with right side taillight and right side rear bumper end piece to rear door.,1
RWD,Serie,4-Aug-23,Upper sliding door run on key is damaged.,3,SLAST5,93828358,CPA,"Guide pin, upper, sliding door, right",991,,Upper sliding door run on key is damaged.,1
RWD,Serie,4-Aug-23,Primer visible at bottom left corner of windshield.,3,TR3ST4,93828358,CPA,Windshield,B1R,,Primer visible at bottom left corner of windshield.,1
RWD,Serie,4-Aug-23,Gaps for windows on left and right rear doors not ok.  Vertical gap on window on left rear door too small.  Vertical gap on window on right rear door too large.,3,TR4ST3,93828358,CPA,"Rear window, rear-end door, left",99E,,Gaps for windows on left and right rear doors not ok.  Vertical gap on window on left rear door too small.  Vertical gap on window on right rear door too large.,1
RWD,Serie,4-Aug-23,Right side middle sliding door guide rail leaked during rain test.,3,TR2ST2,93828358,CPA,"Guide rail, center, sliding door, right",04,,Right side middle sliding door guide rail leaked during rain test.,1
RWD,Serie,9-Aug-23,Hood insulation cover is missing a pushpin.,3,TR2ST1,93841369,CPA,"Engine hood, inner",C7,,Hood insulation cover is missing a pushpin.,1
RWD,Serie,1-Aug-23,Rear sidewall window(s) seals are wavy in multiple sections.,3,TR4ST3,93826808,CPA,"Sealing frame/bonding, side window",I6,,Rear sidewall window(s) seals are wavy in multiple sections.,1
RWD,Serie,4-Aug-23,Front inside right door frame damaged by window guide seal.,3,Z3DMOUN,93824290,CPA,"Front door, right, inside",991,,Front inside right door frame damaged by window guide seal.,1
RWD,Serie,3-Aug-23,Sliding door seal is damaged near the C-pillar.,3,TR2ST5,93830875,CPA,"Sealing/sealing frame, sliding door, right",991,,Sliding door seal is damaged near the C-pillar.,1
RWD,Serie,3-Aug-23,Upper screw on the sliding door run on key bracket is cross threaded.,3,TR2ST2,93830875,CPA,"Sliding door, right",99E,,Upper screw on the sliding door run on key bracket is cross threaded.,1
RWD,Serie,3-Aug-23,"Front left seat box to entrance cover gap measured 4.5mm, tolerance is 4mm.",3,TR2ST4,93830875,CPA,"Seat base, front seat, left",61G,,"Front left seat box to entrance cover gap measured 4.5mm, tolerance is 4mm.",1
RWD,Serie,3-Aug-23,Rear inside left wheel well cover not positioned properly.,3,TR3ST1,93833911,CPA,"Cover, wheel well, rear, left",42V,,Rear inside left wheel well cover not positioned properly.,1
RWD,Serie,1-Aug-23,Lower door lock screws on inside of left rear door not touched up after door adjustment.,3,FINST3,93826808,CPA,"Rear-end door, left, inside",99E,,Lower door lock screws on inside of left rear door not touched up after door adjustment.,1
RWD,Serie,26-Jul-23,Window bag trim not installed correctly over headliner.,3,TR3ST6,93831337,CPA,"Cover, SRS, airbag, right, headliner",42V,,Window bag trim not installed correctly over headliner.,1
RWD,Serie,17-Jul-23,Discoloration on rear right sidewall protective strip.,3,TR4ST6,93800837,CPA,"Protective strip, sidewall, right",26,,Discoloration on rear right sidewall protective strip.,1
RWD,Serie,17-Jul-23,"Right side B-pillar trim not clipped in correctly, bottom of trim not installed behind front door seal.",3,TR4ST7,93800837,CPA,"Trim, B-pillar right",42V,,"Right side B-pillar trim not clipped in correctly, bottom of trim not installed behind front door seal.",1
RWD,Serie,17-Jul-23,Left side airbag wiring harness at headliner visible.,3,TR3ST6,93800837,CPA,Interior wiring harness,42V,,Left side airbag wiring harness at headliner visible.,1
RWD,Serie,17-Jul-23,Front left SRS cover on A-pillar flushness not ok.,3,TR3ST7,93800837,CPA,"Cover, SRS/airbag, trim, A-pillar, left",42U,,Front left SRS cover on A-pillar flushness not ok.,1
RWD,Serie,24-Jul-23,Sharp weld spurs on the upper right inner sidewall.,3,Z2SINNRH,93816163,CPA,"Sidewall, right, inner",09G,,Sharp weld spurs on the upper right inner sidewall.,1
RWD,Serie,24-Jul-23,Rear bumper is missing the underbody left side push pin and the right side underbody push pin is not installed completed,3,TR4ST6,93816163,CPA,Bumper end piece,C7,,Rear bumper is missing the underbody left side push pin and the right side underbody push pin is not installed completed,1
RWD,Serie,24-Jul-23,Right side air inlet grill on engine hood not clipped in properly.,3,TR2ST1,93816163,CPA,"Air inlet grille, right, engine hood",42U,,Right side air inlet grill on engine hood not clipped in properly.,1
RWD,Serie,24-Jul-23,Wrong sliding door panels installed.,3,SDPA,93829786,CPA,"Sliding door, right, inner",C8,,Wrong sliding door panels installed.,1
RWD,Serie,24-Jul-23,Front left seat makes noise while driving.,3,TR4ST8,93829786,CPA,"Front seat, left",367,,Front left seat makes noise while driving.,1
RWD,Serie,19-Jul-23,Center of rear door step cover not assembled properly.,3,TR1ST3,93815975,CPA,"Cover, entrance, rear-end door",424,,Center of rear door step cover not assembled properly.,1
RWD,Serie,19-Jul-23,Excessive PVC on bottom of front right fender.,3,SEAM05,93815975,CPA,"Fender, front, right",B1R,,Excessive PVC on bottom of front right fender.,1
RWD,Serie,19-Jul-23,Sliding door panel anchor is damaged.,3,TR3ST1,93819407,CPA,"Door trim, sliding door, right",996,,Sliding door panel anchor is damaged.,1
RWD,Serie,12-Jul-23,Bottom front left RPM sensor wire not attached to front axle.,3,CHAST9,93801371,CPA,"Rpm sensor, left, front axle",C77,,Bottom front left RPM sensor wire not attached to front axle.,1
RWD,Serie,17-Jul-23,Sidewall Inner panel push pin is damaged.,3,TR3ST1,93802940,CPA,"Panel, sidewall, right",996,,Sidewall Inner panel push pin is damaged.,1
RWD,Serie,14-Jul-23,Left side panel loose above cell phone charger at 4 seater bench seat.,3,TR3ST1,93808475,CPA,"Panel, sidewall, left",38,,Left side panel loose above cell phone charger at 4 seater bench seat.,1
RWD,Serie,14-Jul-23,Rear inside left wheel well cover not positioned properly.,3,TR3ST1,93808475,CPA,"Cover, wheel well, rear, left",42V,,Rear inside left wheel well cover not positioned properly.,1
RWD,Serie,14-Jul-23,Paint rework visible on edge of fuel door.,3,RWKST1,93808475,CPA,Fuel filler flap,K7D,,Paint rework visible on edge of fuel door.,1
RWD,Serie,14-Jul-23,Recess screw not installed on interior right sidewall.,3,TR3ST4,93789832,CPA,"Panel, sidewall, right",C7,,Recess screw not installed on interior right sidewall.,1
RWD,Serie,14-Jul-23,Rear right door wireway cover is damaged,3,TR3ST1,93789832,CPA,Trunk/cargo area,991,,Rear right door wireway cover is damaged.,1
RWD,Serie,12-Jul-23,Screw on rear sliding door lock cross threaded.,3,SDPA,93801371,CPA,"Door lock, sliding door, right",81E,,Screw on rear sliding door lock cross threaded.,1
RWD,Serie,27-Jun-23,Leak at front inside left triangular window during rain test.,3,FDPA1,93811586,CPA,"Sealing frame/bonding, triangular side window, A-pillar, left",04,,Leak at front inside left triangular window during rain test.,1
RWD,Serie,27-Jun-23,Left inside sidewall panel screw missing.,3,TR3ST4,93811586,CPA,"Panel, sidewall, left",C75,,Left inside sidewall panel screw missing.,1
RWD,Serie,22-Jun-23,Leak at front inside left triangular window during rain test.,3,FDPA1,93794238,CPA,"Sealing frame/bonding, triangular side window, A-pillar, left",04,,Leak at front inside left triangular window during rain test.,1
RWD,Serie,26-Jun-23,Def hose on the right side of the underbody is not connected.,3,CHAST2,93780211,CPA,AdBlue(R),C77,,Def hose on the right side of the underbody is not connected.,1
RWD,Serie,26-Jun-23,Hand brake cable on the underbody is missing an edge protector.,3,TR2ST7,93780211,CPA,Parking brake,C7T,,Hand brake cable on the underbody is missing an edge protector.,1
RWD,Serie,16-Jun-23,Air inlet on the right side is loose on the hood.,3,RWKST1,93782936,CPA,"Air inlet grille, right, engine hood",385,,Air inlet on the right side is loose on the hood.,1
RWD,Serie,16-Jun-23,Information label for swivel seats missing from right side of instrument panel.  Part number: A4478172803,3,ENGPLN,93782936,CPA,Information label,C7,,Information label for swivel seats missing from right side of instrument panel.  Part number: A4478172803,1
RWD,Serie,16-Jun-23,Extra 4x4 towing label on the B-pillar.  A906 584 0213,3,TR4ST3,93782936,CPA,Information label,P_12,,Extra 4x4 towing label on the B-pillar.  A906 584 0213,1
RWD,Serie,21-Jun-23,Underbody battery cable not clipped to holder.,3,CHAST1,93783546,CPA,Battery cable,C77,,Underbody battery cable not clipped to holder.,1
RWD,Serie,21-Jun-23,Sliding door panel partially loose.,3,SDPA,93783546,CPA,"Door trim, sliding door, right",385,,Sliding door panel partially loose.,1
RWD,Serie,15-Jun-23,Parktronic sensor on rear bumper flushness not ok.,3,Supply,93785681,CPA,"Wiring harness, rear, PARKTRONIC",42U,,Parktronic sensor on rear bumper flushness not ok.,1
RWD,Serie,10-Mar-23,Fuel water separator hose not clipped into the bracket on the underbody.,3,EPAST1,93662880,CPA,Fuel line,C77,,Fuel water separator hose not clipped into the bracket on the underbody.,1
RWD,Serie,10-Mar-23,Front left and right buffer stops on FEM missing.,3,FINST1,93662880,CPA,"Stop buffer, right, radiator crossmember-engine hood",C7,,Front left and right buffer stops on FEM missing.,1
RWD,Serie,3-Apr-23,Multiple dents on bottom of rear left and right doors.,3,Z3REDOOR,93694479,CPA,"Rear-end door, left",I2,,Multiple dents on bottom of rear left and right doors.,1
RWD,Serie,3-Apr-23,Wrinkles in fabric of right front seat head rest.,3,Supply,93694479,CPA,"Head restraint, seat, front, right",I7,,Wrinkles in fabric of right front seat head rest.,1
RWD,Serie,14-Apr-23,Center left air vent on dash loose.,3,PACST4,93689610,CPA,"Side air vent, left, instrument panel",38,,Center left air vent on dash loose.,1
RWD,Serie,14-Apr-23,"Right side of rear headliner loose, not clipped in properly.",3,OPTST1,93689610,CPA,"Headliner, rear, upper",42U,,"Right side of rear headliner loose, not clipped in properly.",1
RWD,Serie,24-Apr-23,"Front left seat box to entrance cover gap measured 4.5mm, tolerance is 4mm.",3,TR2ST4,93723971,CPA,"Seat base, front seat, left",61G,,"Front left seat box to entrance cover gap measured 4.5mm, tolerance is 4mm.",1
RWD,Serie,24-Apr-23,Left side and Right side rear doors are missing grommets.,3,TR1ST1,93723971,CPA,"Rear-end door, left",C7T,,Left side and Right side rear doors are missing grommets.,1
RWD,Serie,24-Apr-23,Sharp weld splatter on bottom of inner rear left door.,3,Z3REDOOR,93717809,CPA,"Rear-end door, left, inside",423,,Sharp weld splatter on bottom of inner rear left door.,1
RWD,Serie,21-Apr-23,Battery cable grommet not installed properly.,3,MARST4,93715860,CPA,Battery cable,42T,,Battery cable grommet not installed properly.,1
RWD,Serie,20-Apr-23,Black battery cover for starter generator missing.,3,CHAST2,93718740,CPA,"Cap, battery, positive terminal",C7,,Black battery cover for starter generator missing.,1
RWD,Serie,20-Apr-23,Front right triangle trim to mirror making contact.,3,FINST1,93718740,CPA,"Cover, mirror triangle, right",221,,Front right triangle trim to mirror making contact.,1
RWD,Serie,20-Apr-23,Battery cable grommet not installed properly.,3,MARST4,93718740,CPA,Battery cable,42T,,Battery cable grommet not installed properly.,1
RWD,Serie,17-Mar-23,Rubber grommet on right side of air filter holder missing.,3,SLAST5,93672848,CPA,"Holder, air filter",C7T,,Rubber grommet on right side of air filter holder missing.,1
RWD,Serie,17-Mar-23,Front right door trim not installed properly gap along inner frame and window seal visible.,3,FDPA3,93672848,CPA,"Door trim, front door, right",42V,,Front right door trim not installed properly gap along inner frame and window seal visible.,1
RWD,Serie,17-Mar-23,Right side of radio not flush againt instrument panel.,3,PACST4,93672848,CPA,Holder radio,42U,,Right side of radio not flush againt instrument panel.,1
RWD,Serie,15-Mar-23,Two plugs missing from top of left rear wheel well in cargo area.,3,SEAM06,93673325,CPA,"Wheel well, rear, left",C73,,Two plugs missing from top of left rear wheel well in cargo area.,1
RWD,Serie,28-Mar-23,Bottom DEF line along right side frame rail not secured in the clip.,3,CHAST1,93691103,CPA,"Line, AdBlue(R)",C77,,Bottom DEF line along right side frame rail not secured in the clip.,1
RWD,Serie,28-Mar-23,Front right door trim not installed properly gap along inner frame and window seal visible.,3,FDPA3,93691103,CPA,"Door trim, front door, right",42V,,Front right door trim not installed properly gap along inner frame and window seal visible.,1
RWD,Serie,27-Mar-23,Washer fluid hoses on left side of engine compartment twisted.,3,TR2ST4,93690329,CPA,"Hose, windshield washing system",IC,,Washer fluid hoses on left side of engine compartment twisted.,1
RWD,Serie,18-Apr-23,Front right window seal flushness not ok.,3,FDPA1,93708675,CPA,"Window seal, side window, front door, right",42U,,Front right window seal flushness not ok.,1
RWD,Serie,18-Apr-23,Inner sliding door VA3 panel damaged.,3,SDPA,93708675,CPA,"Sliding door, right, inner",991,,Inner sliding door VA3 panel damaged.,1
RWD,Serie,18-Apr-23,Battery box cover shield missing push pin.,3,TR5ST1,93708675,CPA,"Housing cover, battery box",C7,,Battery box cover shield missing push pin.,1
RWD,Serie,18-Apr-23,Rear left wireway cover partially loose.,3,TR3ST1,93708675,CPA,Trunk/cargo area,385,,Rear left wireway cover partially loose.,1
RWD,Serie,14-Mar-23,"Battery box cover shield missing, part number A907 524 0300.",3,TR5ST1,93669992,CPA,"Housing cover, battery box",C7,,"Battery box cover shield missing, part number A907 524 0300.",1
RWD,Serie,5-Apr-23,Plug missing from right sidewall on underbody.,3,TR2ST7,93699585,CPA,"Miscellaneous covers, outside",C73,,Plug missing from right sidewall on underbody.,1
RWD,Serie,14-Mar-23,Excessive residue on the cargo roof at bow 1.,3,Z3UPP01,93671352,CPA,Trunk/cargo area,B1R,,Excessive residue on the cargo roof at bow 1.,1
RWD,Serie,14-Mar-23,Rear inside right sidewall panel fastener missing.,3,TR3ST4,93671352,CPA,"Sidewall, right",C7,,Rear inside right sidewall panel fastener missing.,1
RWD,Serie,24-Mar-23,Radiator fan wiring harness making contact with AC line due to not being  clipped to FEM properly causing.,3,CHAST5,93680635,CPA,Fan,221,,Radiator fan wiring harness making contact with AC line due to not being  clipped to FEM properly causing.,1
RWD,Serie,24-Mar-23,Front left triangle window seal not flush at bottom corner.,3,FDPA1,93680635,CPA,"Sealing frame/bonding, triangular side window, A-pillar, right",42U,,Front left triangle window seal not flush at bottom corner.,1
RWD,Serie,8-May-23,Left side exterior front door has creased dent in at the top.,3,TR4ST9,93741726,CPA,"Front door, left",I2,,Left side exterior front door has creased dent in at the top.,1
RWD,Serie,8-May-23,Lower left side instrument panel is missing multiple screws.,3,PACST3,93741726,CPA,"Lower section, instrument panel",C75,,Lower left side instrument panel is missing multiple screws.,1
RWD,Serie,8-May-23,Right side rear lower interior sidewall seam sealant is damaged near the D-Pillar.,3,TR1ST3,93741726,CPA,"Seam seal, sidewall",991,,Right side rear lower interior sidewall seam sealant is damaged near the D-Pillar.,1
RWD,Serie,8-May-23,Fuel tank vent line grommet not installed properly to left side frame rail.,3,TR2ST8,93735066,CPA,Fuel tank vent system pipe,42T,,Fuel tank vent line grommet not installed properly to left side frame rail.,1
RWD,Serie,25-Apr-23,Rear left and right door arms attached to bracket damaged.,3,,93727105,CPA,"Rear-end door, left, inside",52X,,Rear left and right door arms attached to bracket damaged.,1
RWD,Serie,2-Jun-23,Left and right side D-pillar trim not installed properly.,3,TR4ST7,93760692,CPA,"Trim, D-pillar",424,,Left and right side D-pillar trim not installed properly.,1
RWD,Serie,5-May-23,Windshield washer fluid hose incorrectly routed at reservoir.,3,CHAST5,93733616,CPA,"Hose, windshield washing system",13,,Windshield washer fluid hose incorrectly routed at reservoir.,1
RWD,Serie,5-May-23,Left front RPM sensor wire installed to wrong position on left front strut.,3,CHAST9,93733616,CPA,"Rpm sensor, left, front axle",42V,,Left front RPM sensor wire installed to wrong position on left front strut.,1
