MODEL,CONSTRUCTION_LEVEL,DATE END,REMARKS,NQ,COST CENTER,PNR,TYPE_AUDIT_DESC,PART_DESC,SFARTNR,TURN,Cluster,REMARKS_Column1_Similarity
RWD,Serie,1-Mar-23,Excessive PVC on right side D-pillar at top of taillight.,1,SEAM02,93657807,CPA,D-pillar,K7V,C,Excessive PVC on left side D-pillar at top of taillight.,0.95
RWD,Serie,11-Feb-23,Weld splatter on left rear door.,1,Z3REDOOR,93634574,CPA,"Rear-end door, left",423,A,Weld splatter on rear inside left sidewall.,0.8
RWD,Serie,28-Feb-23,Multiple weld splatter spots on inside of left side cargo wall.,1,Z2SINNLH,93657468,CPA,"Sidewall, left, inner",423,B,Multiple weld splatter spots on inside of right-side cargo wall.,0.95
RWD,Serie,28-Feb-23,Excessive PVC on right side D-pillar at bottom of taillight.,1,SEAM02,93650943,CPA,D-pillar,K7V,C,Excessive PVC on left side D-pillar at top of taillight.,0.86
RWD,Serie,9-Feb-23,Left side of dome lamp flushness not ok.,1,TR3ST6,93630598,CPA,Dome lamp,42U,A,Right side of dome lamp flushness not ok.,0.94
RWD,Serie,9-Feb-23,Small dents on lower left sidewall.,1,Z2SOUTLH,93631141,CPA,"Sidewall, left",I2,C,Small dent on lower left sidewall.,0.97
RWD,Serie,27-Feb-23,Surface damage on rear right sidewall protective strip.,1,TR4ST6,93652634,CPA,"Protective strip, sidewall, right",991,B,Surface damage on sliding door protective strip.,0.75
RWD,Serie,8-Feb-23,Weld splatter on left side D-pillar in cargo area.,1,Z2SCOMLH,93624930,CPA,D-pillar,423,C,Left side D-pillar weld splatter.,0.8
RWD,Serie,24-Feb-23,Sika poorly applied at bottom of left B-pillar.,1,SIKAAUT,93661502,CPA,"B-pillar, left",76A,C,Sika poorly applied at the top of left side C-Pillar.,0.84
RWD,Serie,24-Feb-23,Creased dent out on exterior rear right door.,1,Z3REDOOR,93651487,CPA,"Rear-end door, right",I1,A,Dent out exterior left rear door.,0.8
RWD,Serie,24-Feb-23,Bottom of inside right sliding door has a paint inclusion.,1,FININSPE,93651859,CPA,"Sliding door, right, inner",K1,A,Right side sliding door paint inclusion.,0.77
RWD,Serie,6-Feb-23,Rear inside left and right sidewall VA3 panels damaged.,1,TR3ST4,93628220,CPA,"Sidewall, left, inner",991,C,Rear inside right sidewall VA3 panel damaged.,0.91
RWD,Serie,27-Sep-23,Adhesive residue on right side cargo wall.,1,Z2SINNRH,93899763,CPA,"Sidewall, right, inner",B1R,,Adhesive residue on rear inside right sidewall.,0.87
RWD,Serie,21-Sep-23,Minor weld fault on inner right sidewall.,1,Z2SINNRH,93872034,CPA,"Sidewall, right, inner",423,,Multiple minor weld faults on inside right sidewall.,0.88
RWD,Serie,11-Sep-23,Lower front right air dam flushness not ok.,1,CHAST6,93873040,CPA,"Air deflector, right, radiator",42U,,Bottom front right air dam flushness not ok.,0.83
RWD,Serie,18-Sep-23,Paint inclusion on the left side of the left seat box.,1,FININSPE,93881217,CPA,"Seat base, front seat, left",K1,,Paint inclusion on the rear side of the right seat box.,0.87
RWD,Serie,14-Sep-23,Small paint inclusion on front left door.,1,FININSPE,93883833,CPA,"Front door, left",K1,,Small paint inclusion on rear left door.,0.83
RWD,Serie,14-Sep-23,Paint inclusions on bottom rear of sliding door.,1,FININSPE,93883833,CPA,"Sliding door, right",K1,,Paint inclusion on bottom rear right door.,0.81
RWD,Serie,13-Sep-23,Upper front right air dam flushness not ok.,1,CHAST6,93879088,CPA,"Air deflector, right, radiator",42U,,Bottom front right air dam flushness not ok.,0.82
RWD,Serie,6-Sep-23,Left front door seal wavy at top of B-Pillar trim.,1,TR1ST5,93862993,CPA,"Sealing frame, front door, left",I6,,Front right door seal wavy at the top of B-Pillar trim.,0.91
RWD,Serie,9-Sep-23,Lower front right air dam flushness not ok.,1,CHAST6,93871218,CPA,"Air deflector, right, radiator",42U,,Bottom front right air dam flushness not ok.,0.83
RWD,Serie,9-Sep-23,Out dent on rear left upper sidewall,1,Z2SCOMLH,93871218,CPA,"Sidewall, left",I1,,Dent on  rear right sidewall at wheel well arch.,0.78
RWD,Serie,8-Sep-23,Upper front right air dam flushness not ok.,1,CHAST6,93868529,CPA,"Air deflector, right, radiator",42U,,Bottom front right air dam flushness not ok.,0.82
RWD,Serie,29-Aug-23,Dent out on lower rear right sidewall.,1,Z2SOUTRH,93862399,CPA,"Sidewall, right",I1,,Dent on  rear right sidewall at wheel well arch.,0.78
RWD,Serie,16-Aug-23,Paint is chipped on the lower left front door hinge.,1,TR4ST9,93848703,CPA,"Paint, hinge, lower, front door, left",K8R,,Paint chipped on bottom front right door hinge.,0.79
RWD,Serie,14-Aug-23,Upper front right air dam flushness not ok.,1,CHAST6,93852515,CPA,"Air deflector, right, radiator",42U,,Bottom front right air dam flushness not ok.,0.82
RWD,Serie,8-Aug-23,Bottom front air duct flushness not ok.,1,CHAST6,93820819,CPA,"Air deflector, left, radiator",42U,,Bottom front left air duct flushness not ok.,0.98
RWD,Serie,4-Aug-23,Lower door lock screw on inside of left rear door not touched up after door adjustment.,1,FINST3,93828358,CPA,"Rear-end door, left, inside",99E,,Lower door lock screws on inside of left rear door not touched up after door adjustment.,0.99
RWD,Serie,4-Aug-23,Lower door lock screw on inside of left rear door not touched up after door adjustment.,1,FINST3,93824290,CPA,"Rear-end door, left, inside",99E,,Lower door lock screws on inside of left rear door not touched up after door adjustment.,0.99
RWD,Serie,26-Jul-23,Weld splatter on left side cargo wall at top.,1,Z2SINNLH,93831337,CPA,"Sidewall, left, inner",09G,,Weld splatter in multiple areas on left side cargo wall.,0.83
RWD,Serie,26-Jul-23,Right side front door seal is wavy.,1,TR2ST5,93831337,CPA,"Seal, front door, right",I6,,Front Left door seal is wavy.,0.86
RWD,Serie,17-Jul-23,Right side of radio trim flushness not ok.,1,PACST4,93800837,CPA,"Front plate, radio sets",42U,,Top and right side of radio trim flushness not ok.,0.94
RWD,Serie,17-Jul-23,Paint inclusions on left front seat box.,1,FININSPE,93800837,CPA,"Paint, seat base, front seat, left",K1,,Paint inclusion on left side of driver seat box.,0.75
RWD,Serie,25-Jul-23,Lower front right air dam flushness not ok.,1,CHAST6,93815538,CPA,"Air deflector, right, radiator",42U,,Bottom front right air dam flushness not ok.,0.83
RWD,Serie,24-Jul-23,Sliding door window seal flushness not ok.,1,TR4ST3,93816163,CPA,"Sealing frame, fixed side window, sliding door, right",42U,,Front right window seal flushness not ok.,0.76
RWD,Serie,24-Jul-23,Dent on lower sliding door.,1,TR3ST2,93829786,CPA,"Sliding door, right",I1,,Dent in on the lower exterior sliding door.,0.82
RWD,Serie,19-Jul-23,Paint inclusion on rear inside left wheel well.,1,FININSPE,93815975,CPA,"Wheel well, rear, inner, left",K1,,Paint inclusion on rear right wheel well.,0.88
RWD,Serie,19-Jul-23,Dent on outer left sidewall.,1,Z2SCOMLH,93815975,CPA,"Sidewall, left",I1,,Outer rear right sidewall dent.,0.78
RWD,Serie,19-Jul-23,Upper front right air dam flushness not ok.,1,CHAST6,93819407,CPA,"Air deflector, right, radiator",42U,,Bottom front right air dam flushness not ok.,0.82
RWD,Serie,19-Jul-23,Paint inclusion on the front side of the right seat box.,1,FININSPE,93819407,CPA,"Seat base, front seat, right",K1,,Paint inclusion on the rear side of the right seat box.,0.91
RWD,Serie,13-Jul-23,Bottom rear of sliding door has a dent.,1,TR3ST2,93810539,CPA,"Sliding door, right",I2,,Dent on bottom of sliding door.,0.77
RWD,Serie,17-Jul-23,Rear right sidewall panel flushness not ok.,1,TR3ST1,93802940,CPA,"Panel, sidewall, right",42U,,Front inside left door panel flushness not ok.,0.75
RWD,Serie,14-Jul-23,Paint inclusion on inside of right rear door.,1,BCCOAT,93808475,CPA,"Rear-end door, right, inside",K1,,Left side cargo door paint inclusions dirt.,0.8
RWD,Serie,14-Jul-23,Weld splatter on left rear door by door handle.,1,Z3REDOOR,93808475,CPA,"Rear-end door, left",423,,Weld splatter on rear inside left sidewall.,0.78
RWD,Serie,14-Jul-23,Right B-pillar has paint inclusions/dirt.,1,FININSPE,93789832,CPA,"B-pillar, right",K1,,Right B-pillar portal paint inclusions/dirt.,0.81
RWD,Serie,26-Jun-23,Lower outside sliding door bent in,1,TR3ST2,93780211,CPA,"Sliding door, right",A5,,Dent in on the lower exterior sliding door.,0.75
RWD,Serie,15-Jun-23,Paint run on upper left D-pillar.,1,FININSPE,93785681,CPA,D-pillar,K2,,Paint run on upper right D-pillar.,0.92
RWD,Serie,14-Jun-23,Air dam on right side of the front bumper is not flush.,1,CHAST6,93790210,CPA,"Air deflector, right, radiator",42U,,Air dam on right and left side of the front bumper is not flush.,0.94
RWD,Serie,15-Jun-23,Paint inclusion on inner rear right sidewall.,1,FININSPE,93785681,CPA,"Sidewall, right",K1,,Left side cargo door paint inclusions dirt.,0.8
RWD,Serie,14-Apr-23,Bottom front left and right air dam flushness not ok.,1,CHAST6,93689610,CPA,"Air deflector, left, radiator",42U,,Bottom front right air dam flushness not ok.,0.93
RWD,Serie,14-Apr-23,Dent on the lower exterior sliding door.,1,Z3SLIDOR,93689610,CPA,"Sliding door, right",I2,,Dent in on the lower exterior sliding door.,0.95
RWD,Serie,24-Apr-23,Minor weld fault on inner right sidewall behind the sliding door.,1,Z2SINNRH,93723971,CPA,"Sidewall, right, inner",423,,Multiple minor weld faults on inside right sidewall.,0.83
RWD,Serie,24-Apr-23,Paint inclusions on front right fender.,1,FININSPE,93717809,CPA,"Fender, front, right",K1,,Left side cargo door paint inclusions dirt.,0.8
RWD,Serie,21-Apr-23,Rear inside left wheel well paint inclusion.,1,FININSPE,93715860,CPA,"Wheel well, rear, inner, left",K1,,Paint inclusion on rear right wheel well.,0.88
RWD,Serie,28-Mar-23,Dent on bottom of rear right door.,1,Z3REDOOR,93691103,CPA,"Rear-end door, right",I1,,Multiple dents on bottom of rear left and right doors.,0.81
RWD,Serie,27-Mar-23,Top radio trim flushness not ok.,1,PACST4,93690329,CPA,"Front plate, radio sets",42U,,Top and right side of radio trim flushness not ok.,0.92
RWD,Serie,18-Apr-23,Paint inclusion on front left seat box.,1,FININSPE,93708675,CPA,"Seat base, front seat, left",K1,,Paint inclusion on left side of driver seat box.,0.75
RWD,Serie,5-Apr-23,Windshield washer fluid hose not correctly routed on the reservoir.,1,CHAST5,93699585,CPA,"Hose, windshield washer system left",13,,Windshield washer fluid hose incorrectly routed at reservoir.,0.86
RWD,Serie,24-Mar-23,Engine EVAP hose not routed correctly.,1,CHAST5,93680635,CPA,Engine compartment,13,,Fuel evap hose is not routed correctly.,0.77
RWD,Serie,24-Mar-23,Dent on bottom of right sliding door.,1,Z3SLIDOR,93680635,CPA,"Sliding door, right",I2,,Dent on bottom of sliding door.,0.96
RWD,Serie,2-Jun-23,Paint damaged on front right door at door lock assembly.,1,FININSPE,93760692,CPA,"Paint, front door, right, inner",991,,Paint damaged on front left door at door lock assembly.,0.94
RWD,Serie,5-May-23,Paint inclusion on bottom rear right near tailight.,1,FININSPE,93730117,CPA,"Sidewall, right",K1,,Paint inclusion on bottom rear right door.,0.77
RWD,Serie,5-May-23,Paint run on left side sidewall near rear wheel well..,1,FININSPE,93730117,CPA,"Sidewall, left",K2,,Paint run on rear inside right sidewall.,0.77
RWD,Serie,5-May-23,Creased dents in on the exterior rear left door.,1,Z3REDOOR,93730117,CPA,"Rear-end door, left",I2,,Dent out exterior left rear door.,0.78
RWD,Serie,14-Jun-23,Paint is chipped on the lower left front door hinge.,1,TR4ST9,93790210,CPA,"Paint, hinge, lower, front door, left",K8R,,Paint chipped on bottom front right door hinge.,0.79
RWD,Serie,2-Jun-23,Creased dent out on exterior rear right door by the emblem.,1,Z3REDOOR,93759967,CPA,"Rear-end door, right",I1,,Dent out exterior left rear door.,0.8
RWD,Serie,18-May-23,Paint chips on inside right B-pillar beside sliding door striker.,1,TR3ST6,93755155,CPA,"B-pillar, right, inner",K8R,,Paint chips on inside right B-pillar.,0.81
RWD,Serie,25-May-23,Paint inclusion on inner rear right door.,1,FININSPE,93748580,CPA,"Rear-end door, right, inside",K1,,Left side cargo door paint inclusions dirt.,0.8
RWD,Serie,25-May-23,Dent left side sidewall at rear wheel well.,1,Z2SCOMLH,93748580,CPA,"Sidewall, left",I2,,Dent on  rear right sidewall at wheel well arch.,0.78
RWD,Serie,13-May-23,Upper rear left door damaged.,1,FINST2,93752871,CPA,"Rear-end door, left",991,,Right side of rear bumper damaged.,0.76
RWD,Serie,29-Apr-23,Excessive adhesive residue on inside right sliding door.,1,Z3SLIDOR,93729721,CPA,"Sliding door, right, inner",B1R,,Adhesive residue on rear inside right sidewall.,0.78
RWD,Serie,25-May-23,Paint chip on top right side of front right seat box.,1,TR4ST8,93750677,CPA,"Seat base, front seat, right",K8R,,Paint chip on front side of driver seat box.,0.81
RWD,Serie,11-May-23,Weld splatter on rear inside right sidewall.,1,Z2SINNRH,93735637,CPA,"Sidewall, right, inner",423,,Weld splatter on rear inside left sidewall.,0.91
RWD,Serie,11-May-23,Weld splatter on roof bows.,1,Z2BPASSY,93735637,CPA,"Roof bow, rear",423,,Roof bow has weld splatter.,0.85
RWD,Serie,11-May-23,Multiple dents on rear doors.,1,Z3REDOOR,93735637,CPA,"Rear-end door, left",I2,,Multiple dents on bottom of rear left and right doors.,0.82
RWD,Serie,22-May-23,Dent left side sidewall at rear wheel well.,1,Z2SOUTLH,93752715,CPA,"Sidewall, left",I2,,Dent on  rear right sidewall at wheel well arch.,0.78
RWD,Serie,9-Sep-22,Excessive anti-flutter material on left side cargo wall.,1,Z2SINNLH,93509586,CPA,"Sidewall, left, inner",B1R,,Excessive anti-flutter material/glue on right side cargo wall.,0.9
RWD,Serie,9-Sep-22,Weld splatter on right side cargo wall along center pillar.,1,Z2SCOMRH,93509586,CPA,"Sidewall, right, inner",423,,Weld splatter on left side cargo wall along center pillar.,0.94
RWD,Serie,9-Sep-22,Front right door seal wavy at bottom of A-Pillar trim.,1,EVS,93509586,CPA,"Sealing frame, front door, right",I6,,Front right door seal wavy at the top of B-Pillar trim.,0.79
RWD,Serie,9-Sep-22,Front left door seal wavy at bottom of B-pillar trim.,1,EVS,93509586,CPA,"Sealing frame, front door, left",I6,,Front right door seal wavy at the top of B-Pillar trim.,0.9
RWD,Serie,26-Oct-22,Minor weld faults on rear inside right sidewall.,1,Z2SCOMRH,93570216,CPA,"Sidewall, right, inner",423,,Multiple minor weld faults on inside right sidewall.,0.92
RWD,Serie,10-Oct-22,Bottom front left air dam flushness not ok.,1,CHAST6,93540730,CPA,"Air deflector, left, radiator",42U,,Bottom front right air dam flushness not ok.,0.94
RWD,Serie,8-Sep-22,Rear left sidewall panel flushness not ok.,1,TR3ST4,93498152,CPA,"Panel, sidewall, left",42U,,Front inside left door panel flushness not ok.,0.75
RWD,Serie,24-Oct-22,Dent out on right side B-pillar.,1,Z2SCOMRH,93553071,CPA,"B-pillar, right",I1,,Dent-in on right B-pillar,0.75
RWD,Serie,23-Sep-22,Dent on rear left D-pillar.,1,Z2SCOMLH,93532646,CPA,D-pillar,I2,,Dent on bottom rear inside right D-pillar.,0.84
RWD,Serie,24-Oct-22,Dent in on right sidewall at wheel well arch.,1,Z2SCOMRH,93572964,CPA,"Sidewall, right",I2,,Dent on  rear right sidewall at wheel well arch.,0.89
RWD,Serie,22-Oct-22,Adhesive residue on inner right C-pillar.,1,SEAM02,93565802,CPA,"C-pillar, right, inner",B1R,,Adhesive residue on rear inside right sidewall.,0.8
RWD,Serie,6-Oct-22,Paint chip on right sidewall near sliding door guide rail.,1,TR2ST1,93546307,CPA,"Sidewall, right",K8R,,Right sidewall scratched at C-pillar just below middle sliding door guide rail.,0.76
RWD,Serie,11-Nov-22,Front right wheel well cover flushness not OK.,1,CHAST6,93590347,CPA,"Cover, wheel well, front, right",42U,,Front left wheel well cover flushness not ok.,0.93
RWD,Serie,10-Nov-22,Front right SRS cover on A-pillar flushness not ok.,1,TR3ST7,93584373,CPA,"Cover, SRS/airbag, trim, A-pillar, right",42U,,Front left SRS cover on A-pillar flushness not ok.,0.94
RWD,Serie,5-Oct-22,"Front left door trim not installed properly, window seal visible.",1,FDPA3,93542132,CPA,"Cover, door trim, front door, left",42V,,Front right door trim not installed properly gap along inner frame and window seal visible.,0.78
RWD,Serie,5-Oct-22,Excessive anti-flutter material on top left side of cargo wall.,1,Z2SINNLH,93542132,CPA,"Sidewall, left, inner",B1R,,Excessive anti-flutter material/glue on right side cargo wall.,0.9
RWD,Serie,9-Nov-22,Paint chip on front side of passenger seat box.,1,TR2ST4,93586816,CPA,"Seat base, front seat, right",K8R,,Paint chip on front side of driver seat box.,0.81
RWD,Serie,9-Nov-22,Front left wheel well cover not installed properly.,1,CHAST6,93586816,CPA,"Cover, wheel well, front, left",99E,,Rear inside left wheel well cover not positioned properly.,0.76
RWD,Serie,20-Oct-22,Paint rework visible on inner right C-pillar.,1,FININSPE,93554731,CPA,"C-pillar, right, inner",K7D,,Paint rework visible on right side C-pillar.,0.88
RWD,Serie,20-Oct-22,Paint inclusions on rear left sidewall by taillight.,1,FININSPE,93554731,CPA,"Sidewall, left",K1,,Paint inclusion on rear right sidewall by taillight.,0.93
RWD,Serie,4-Oct-22,Dent out on rear right sidewall at wheel well arch.,1,Z2SOUTRH,93539021,CPA,"Sidewall, right",I1,,Dent on  rear right sidewall at wheel well arch.,0.93
RWD,Serie,21-Sep-22,Rear right inner wheel well cover not installed properly.,1,TR3ST1,93515880,CPA,"Cover, wheel well, rear, right",42V,,Rear inside left wheel well cover not positioned properly.,0.75
RWD,Serie,20-Oct-22,Dent out on right sidewall above sliding door guide rail.,1,Z2SOUTRH,93566040,CPA,"Sidewall, right",I1,,Dent on right sidewall above sliding door guide rail.,0.93
RWD,Serie,20-Oct-22,Paint inclusion on bottom rear right sidewall behind sliding door.,1,FININSPE,93566040,CPA,"Sidewall, right",K1,,Paint inclusion on bottom rear right door.,0.78
RWD,Serie,3-Oct-22,Front right bumper to fender flushness not ok.,1,CHAST6,93539179,CPA,Front bumper,42U,,Front left headlight to fender flushness not ok.,0.75
RWD,Serie,20-Sep-22,Dent out on rear right sidewall.,1,Z2SCOMRH,93523587,CPA,"Sidewall, right",I1,,Dent on  rear right sidewall at wheel well arch.,0.78
RWD,Serie,20-Sep-22,Paint inclusion on  upper rear right door.,1,FININSPE,93523587,CPA,"Rear-end door, right",K1,,Right side sliding door paint inclusion.,0.75
RWD,Serie,20-Sep-22,Dent in on sliding door.,1,Z3SLIDOR,93523587,CPA,"Sliding door, right",I2,,Dent in on the lower exterior sliding door.,0.77
RWD,Serie,7-Nov-22,Front right wheel well cover flushness not OK.,1,CHAST6,93581130,CPA,"Cover, wheel well, front, right",42U,,Front left wheel well cover flushness not ok.,0.93
RWD,Serie,29-Sep-22,Dent out on rear left sidewall at wheel well arch.,1,Z2SOUTLH,93535870,CPA,"Sidewall, left",I1,,Dent on  rear right sidewall at wheel well arch.,0.93
RWD,Serie,19-Sep-22,Front right door entrance protective foil starting to peel up at the corner.,1,TR3ST5,93523777,CPA,"Entrance, front door, right",99E,,Front left door entrance protective foil starting to peel up at the corner.,0.97
RWD,Serie,4-Nov-22,Excessive adhesive residue on rear inside right sidewall.,1,Z2SINNRH,93578680,CPA,"Sidewall, right, inner",B1R,,Adhesive residue on rear inside right sidewall.,0.89
RWD,Serie,4-Nov-22,Paint inclusion on front inside right door frame.,1,FININSPE,93578680,CPA,"Front door, right, inside",K1,,Left side cargo door paint inclusions dirt.,0.8
RWD,Serie,3-Nov-22,Excessive adhesive residue on rear inside right sidewall.,1,Z2SINNRH,93573921,CPA,"Sidewall, right, inner",B1R,,Adhesive residue on rear inside right sidewall.,0.89
RWD,Serie,17-Oct-22,Clear protective sticker not installed properly at bottom right B-pillar.,1,TR4ST9,93564508,CPA,"Sticker, B-pillar",42V,,Clear protective sticker not installed properly at bottom left B-pillar.,0.96
RWD,Serie,15-Oct-22,Bottom of rear left bumper damaged.,1,TR5ST1,93557254,CPA,"Plastic trim, rear bumper",991,,Right side of rear bumper damaged.,0.76
RWD,Serie,14-Oct-22,Far left instrument panel trim at A-pillar scratched.,1,TR3ST8,93553048,CPA,"Cover, outer, left, instrument panel",385,,Far left instrument panel trim at A-pillar partially loose.,0.79
RWD,Serie,27-Sep-22,Excessive anti-flutter material on top left side of cargo wall.,1,Z2SINNLH,93518801,CPA,"Sidewall, left, inner",B1R,,Excessive anti-flutter material/glue on right side cargo wall.,0.9
RWD,Serie,27-Sep-22,Front right door seal wavy at bottom of A-Pillar trim.,1,EVS,93518801,CPA,"Sealing frame, front door, right",I6,,Front right door seal wavy at the top of B-Pillar trim.,0.79
RWD,Serie,15-Sep-22,Paint run on rear inside left door.,1,FINST3,93508059,CPA,"Rear-end door, left, inside",K2,,Paint run on rear inside right sidewall.,0.78
RWD,Serie,2-Nov-22,Front left bumper to fender flushness not ok.,1,CHAST6,93561009,CPA,Front bumper,42U,,Front left headlight to fender flushness not ok.,0.75
RWD,Serie,14-Oct-22,Front right door seal wavy at bottom of A-Pillar trim.,1,EVS,93532810,CPA,"Sealing frame, front door, right",I6,,Front right door seal wavy at the top of B-Pillar trim.,0.79
RWD,Serie,27-Sep-22,Front left door wiring harness boot flushness not ok against door.,1,FDPA1,93538650,CPA,"Boot, wiring harness, front door, left",42U,,Rear right door wiring harness boot flushness not ok against D-pillar.,0.8
RWD,Serie,14-Sep-22,Excessive adhesive residue on roof bow 1.,1,Z3UPP01,93515765,CPA,"Roof bow, front",B1R,,Excessive residue on the cargo roof at bow 1.,0.76
RWD,Serie,14-Sep-22,Minor weld faults on top rear inside right sidewall.,1,Z2SINNRH,93515765,CPA,"Sidewall, right, inner",423,,Multiple minor weld faults on inside right sidewall.,0.92
RWD,Serie,14-Sep-22,Adhesive residue on inside left sidewall.,1,Z2SINNLH,93515765,CPA,"Sidewall, left, inner",B1R,,Adhesive residue on rear inside right sidewall.,0.91
RWD,Serie,1-Nov-22,Missing one spreader rivet from the bottom of front left door trim.,1,FDPA3,93570455,CPA,"Door trim, front door, right",C7,,All spreader rivets missing from the bottom of front right door trim.,0.89
RWD,Serie,28-Oct-22,PVC residue on left side D-pillar at top of taillight.,1,SEAM02,93555589,CPA,D-pillar,K7V,,Excessive PVC on left side D-pillar at top of taillight.,0.8
RWD,Serie,13-Sep-22,Top right corner of sliding door panel damaged.,1,SDPA,93515120,CPA,"Sliding door, right, inner",991,,Top right corner of upper sliding door panel damaged.,0.92
RWD,Serie,13-Sep-22,Paint inclusion on the right side of the right seat box.,1,FININSPE,93508943,CPA,"Seat base, front seat, right",K1,,Paint inclusion on the rear side of the right seat box.,0.91
RWD,Serie,24-Sep-22,Adhesive residue on inside left sidewall.,1,Z2SINNLH,93530475,CPA,"Sidewall, left, inner",B1R,,Adhesive residue on rear inside right sidewall.,0.91
RWD,Serie,28-Oct-22,Paint run on front left fender.,1,FINST1,93559623,CPA,"Fender, front, left",K2,,Paint runs on inner front right fender.,0.82
RWD,Serie,27-Oct-22,PVC residue on left side D-pillar at top near taillight.,1,SEAM02,93564987,CPA,D-pillar,K7V,,Excessive PVC on left side D-pillar at top of taillight.,0.8
RWD,Serie,27-Oct-22,Dent on rear inside left sidewall.,1,Z2SINNLH,93564987,CPA,"Sidewall, left, inner",I2,,Dent on  rear right sidewall at wheel well arch.,0.78
RWD,Serie,24-Sep-22,Scratch at top rear of passenger seat box.,1,TR4ST8,93522316,CPA,"Seat base, front seat, right",K8R,,Scratches on top rear of passenger seat box.,0.88
RWD,Serie,4-Feb-23,Dent on right sidewall near sliding door.,1,Z2SCOMRH,93628261,CPA,"Sidewall, right",I1,,Dent in on right sidewall near sliding door and protective strip.,0.78
RWD,Serie,4-Feb-23,Discoloration on front of right sidewall protective strip.,1,Supply,93628261,CPA,"Protective strip, sidewall, right",26,,Discoloration on rear right sidewall protective strip.,0.83
RWD,Serie,12-Dec-22,Adhesive residue on rear inside left sidewall.,1,Z2SINNLH,93611648,CPA,"Sidewall, right, inner",B1R,,Adhesive residue on rear inside right sidewall.,0.91
RWD,Serie,9-Dec-22,Adhesive residue on inside right D-pillar.,1,Z2SCOMRH,93607737,CPA,D-pillar,B1R,,Adhesive residue on rear inside right sidewall.,0.83
RWD,Serie,15-Nov-22,Weld splatter on top inside right rear door.,1,Z3REDOOR,93585693,CPA,"Rear-end door, right, inside",423,,Weld splatter on top left rear entrance.,0.87
RWD,Serie,15-Nov-22,Vin label on the left side seat box NOK.,1,TR3ST6,93583664,CPA,Information label,99E,,VIN label on left side of left front seat box not aligned properly.,0.75
RWD,Serie,9-Dec-22,Creased dent on rear right door near the emblem.,1,Z3REDOOR,93607737,CPA,"Rear-end door, right",I1,,Dent out exterior left rear door.,0.77
RWD,Serie,8-Dec-22,Right side front door seal is wavy.,1,EVS,93617223,CPA,"Seal, front door, right",I6,,Front Left door seal is wavy.,0.86
RWD,Serie,7-Dec-22,Front right-side air vent not installed properly.  Vent is not in the correct orientation when the adjustment wheel is completely open or closed.,1,PACST4,93612075,CPA,"Air vent, front, outer, right",42V,,Front outer left air vent not installed correctly.  Vent not in correct orientation when adjustment wheel is completely opened or closed.,0.87
RWD,Serie,7-Dec-22,Paint chip on left B-pillar.,1,CHAST8,93618957,CPA,"B-pillar, left",K8R,,Paint chips on inside right B-pillar.,0.85
RWD,Serie,6-Dec-22,Paint inclusions on top edge of right front fender.,1,BCCOAT,93602787,CPA,"Paint, fender, front, right",K1,,Left side cargo door paint inclusions dirt.,0.8
RWD,Serie,5-Dec-22,Contaminated paint on front of left side seat box.,1,BCCOAT,93590818,CPA,"Seat base, front seat, left",800,,contamination on left side seat box,0.82
RWD,Serie,8-Mar-23,Dent-in on lower inner rear left door.,1,Z3REDOOR,93664175,CPA,"Rear-end door, left",I2,,Dent out exterior left rear door.,0.78
RWD,Serie,3-Dec-22,Dent-in on top rear of driver seat box.,1,TR4ST8,93598175,CPA,"Seat base, front seat, left",I2,,Front of left seat box scratched.,0.76
RWD,Serie,2-Dec-22,Excessive adhesive residue on rear inside right sidewall.,1,Z2SCOMRH,93598738,CPA,"Sidewall, right, inner",B1R,,Adhesive residue on rear inside right sidewall.,0.89
