MODEL,CONSTRUCTION_LEVEL,DATE END,REMARKS,NQ,COST CENTER,PNR,TYPE_AUDIT_DESC,PART_DESC,SFARTNR,TURN,Cluster,REMARKS_Column1_Similarity
RWD,Serie,8-Sep-22,Rear axle vent tube not connected to rear axle.,1,CHAST9,93498152,CPA,"Vent line, rear axle housing",582,,Rear axle vent tube not connected to rear axle.,1
RWD,Serie,24-Oct-22,Sliding door entrance cover seal not positioned properly.,1,TR2ST6,93556702,CPA,"Cover, entrance, sliding door, right",42V,,Sliding door entrance cover seal not positioned properly.,1
RWD,Serie,24-Oct-22,Weld splatter in multiple areas on left side cargo wall.,1,Z2SCOMLH,93574234,CPA,"Sidewall, left, inner",423,,Weld splatter in multiple areas on left side cargo wall.,1
RWD,Serie,24-Oct-22,Windshield washer fluid hose on front left side of engine compartment not zip tied.,1,TR2ST4,93574234,CPA,"Hose, windshield washing system",C77,,Windshield washer fluid hose on front left side of engine compartment not zip tied.,1
RWD,Serie,23-Sep-22,Dent on  rear right sidewall at wheel well arch.,1,Z2SOUTRH,93532646,CPA,"Sidewall, right",I1,,Dent on  rear right sidewall at wheel well arch.,1
RWD,Serie,23-Sep-22,Cargo area wireway cover on left sidewall not installed properly.,1,TR3ST1,93535409,CPA,Trunk/cargo area,42V,,Cargo area wireway cover on left sidewall not installed properly.,1
RWD,Serie,24-Oct-22,Dent on left sidewall at C-pillar.,1,Z2SOUTLH,93572964,CPA,"Sidewall, left",I2,,Dent on left sidewall at C-pillar.,1
RWD,Serie,22-Oct-22,Front LED cargo light not clipped fully to bracket attached to roof bow.,1,TR3ST6,93545168,CPA,Interior lamp,C77,,Front LED cargo light not clipped fully to bracket attached to roof bow.,1
RWD,Serie,11-Nov-22,Brake line not clipped in.,1,TR2ST7,93590347,CPA,"Brake line, rear axle, left",99E,,Brake line not clipped in.,1
RWD,Serie,9-Nov-22,Front right bumper stress mark along top at fender.,1,CHAST6,93582062,CPA,Front bumper,26,,Front right bumper stress mark along top at fender.,1
RWD,Serie,5-Oct-22,Excessive anti-flutter material/glue on right side cargo wall.,1,Z2SINNRH,93542132,CPA,"Sidewall, right, inner",B1R,,Excessive anti-flutter material/glue on right side cargo wall.,1
RWD,Serie,5-Oct-22,Dent out on right sidewall by sliding door.,1,Z2SCOMRH,93542132,CPA,"Sidewall, right",I1,,Dent out on right sidewall by sliding door.,1
RWD,Serie,9-Nov-22,Paint chipped on bottom front right door hinge.,1,TR4ST9,93586816,CPA,"Hinge, lower, front door, right",K8R,,Paint chipped on bottom front right door hinge.,1
RWD,Serie,9-Nov-22,Hood liner push pin missing.,1,TR2ST1,93586816,CPA,Engine hood,C7,,Hood liner push pin missing.,1
RWD,Serie,20-Oct-22,Bottom front right air dam not installed properly.,1,CHAST6,93553154,CPA,"Air deflector, right, radiator",42V,,Bottom front right air dam not installed properly.,1
RWD,Serie,20-Oct-22,Front inside left door handle damaged around screw.,1,TR4ST8,93553154,CPA,"Door handle, front door, left",991,,Front inside left door handle damaged around screw.,1
RWD,Serie,20-Oct-22,Inside left B-pillar trim has minor damage.,1,TR4ST7,93553154,CPA,"Trim, B-pillar left",991,,Inside left B-pillar trim has minor damage.,1
RWD,Serie,20-Oct-22,Rear inside right B-pillar trim discolored.,1,Supply,93553154,CPA,"Trim, B-pillar right",26,,Rear inside right B-pillar trim discolored.,1
RWD,Serie,20-Oct-22,Engine oil label damaged.,1,SLAST4,93553154,CPA,Information label,991,,Engine oil label damaged.,1
RWD,Serie,4-Oct-22,Rework visible on lower rear left door hinge.,1,FINST3,93539021,CPA,"Hinge, left, lower, rear-end door/liftgate",K7D,,Rework visible on lower rear left door hinge.,1
RWD,Serie,21-Sep-22,Left interior D-pillar trim not clipped in.,1,TR4ST7,93515880,CPA,"Trim, D-pillar",C77,,Left interior D-pillar trim not clipped in.,1
RWD,Serie,8-Nov-22,Front left door entrance cover not installed properly behind door seal.,1,TR3ST6,93579621,CPA,"Cover, entrance, front door, left",42V,,Front left door entrance cover not installed properly behind door seal.,1
RWD,Serie,8-Nov-22,Adhesive residue on bottom of B-pillar.,1,SIDEREP,93579621,CPA,"B-pillar, right",B1R,,Adhesive residue on bottom of B-pillar.,1
RWD,Serie,8-Nov-22,Paint chipped on bottom front right door hinge.,1,TR4ST9,93567642,CPA,"Hinge, lower, front door, right",K8R,,Paint chipped on bottom front right door hinge.,1
RWD,Serie,3-Oct-22,Bottom front right air duct not positioned properly.,1,CHAST6,93539179,CPA,"Air deflector, right, radiator",42V,,Bottom front right air duct not positioned properly.,1
RWD,Serie,3-Oct-22,Tire pressure monitor sensor not installed correctly.,1,TR2ST8,93539179,CPA,"Control unit, tire pressure monitor",42V,,Tire pressure monitor sensor not installed correctly.,1
RWD,Serie,19-Oct-22,Paint run on left side B-pillar behind fuel door.,1,BCCOAT,93550218,CPA,"B-pillar, left",K2,,Paint run on left side B-pillar behind fuel door.,1
RWD,Serie,29-Sep-22,Inner sliding door leak coming in from behind lower panel.,1,SDPA,93535870,CPA,"Sliding door, right, inner",04,,Inner sliding door leak coming in from behind lower panel.,1
RWD,Serie,29-Sep-22,Right side of rear bumper damaged.,1,TR4ST6,93535870,CPA,Bumper end piece,991,,Right side of rear bumper damaged.,1
RWD,Serie,19-Sep-22,Dent on left sidewall by taillight.,1,Z2SINNLH,93523777,CPA,"Sidewall, left",I2,,Dent on left sidewall by taillight.,1
RWD,Serie,19-Sep-22,Cargo load label is installed in incorrect location. Label is suppose to be on the rear door panel when there is no sliding door.,1,TR3ST6,93523777,CPA,"Information label, load capacity",99E,,Cargo load label is installed in incorrect location. Label is suppose to be on the rear door panel when there is no sliding door.,1
RWD,Serie,19-Sep-22,Chrome trim of radiator grille partially loose.,1,Supply,93523777,CPA,"Trim piece, radiator grille",38,,Chrome trim of radiator grille partially loose.,1
RWD,Serie,19-Sep-22,Paint chip on front left fender near driver door.,1,TR4ST9,93518231,CPA,"Fender, front, left",K8R,,Paint chip on front left fender near driver door.,1
RWD,Serie,3-Nov-22,Windshield washer fluid hose on front left side of engine compartment not zip tied.,1,TR2ST4,93573921,CPA,"Hose, windshield washing system",C77,,Windshield washer fluid hose on front left side of engine compartment not zip tied.,1
RWD,Serie,15-Oct-22,PVC poorly painted on bottom inside left sidewall.,1,SEAM06,93557254,CPA,"Sidewall, left, inner",K7V,,PVC poorly painted on bottom inside left sidewall.,1
RWD,Serie,28-Sep-22,Front left door entrance protective foil starting to peel up at the corner.,1,TR3ST5,93532620,CPA,"Entrance, front door, left",99E,,Front left door entrance protective foil starting to peel up at the corner.,1
RWD,Serie,2-Nov-22,Lower door lock screws on inside of left rear door not touched up after door adjustment.,1,FINST3,93580660,CPA,"Rear-end door, left, inside",99E,,Lower door lock screws on inside of left rear door not touched up after door adjustment.,1
RWD,Serie,14-Oct-22,Right sliding door middle panel has minor damage.,1,SDPA,93553048,CPA,"Sliding door, right, inner",991,,Right sliding door middle panel has minor damage.,1
RWD,Serie,14-Oct-22,Rear brake line not secured in clip on underbody.,1,TR2ST7,93533412,CPA,Brake line rear (hydraulics),C77,,Rear brake line not secured in clip on underbody.,1
RWD,Serie,15-Sep-22,Dent in on right sidewall near sliding door and protective strip.,1,Z2SOUTRH,93495232,CPA,"Sidewall, right",I2,,Dent in on right sidewall near sliding door and protective strip.,1
RWD,Serie,15-Sep-22,Front left door entrance protective foil starting to peel up at the corner.,1,TR3ST5,93495232,CPA,"Entrance, front door, left",99E,,Front left door entrance protective foil starting to peel up at the corner.,1
RWD,Serie,15-Sep-22,Windshield adhesive on front right hood hinge.,1,TR4ST2,93508059,CPA,"Hinge, right, engine hood",B1R,,Windshield adhesive on front right hood hinge.,1
RWD,Serie,14-Oct-22,Front left door entrance protective foil starting to peel up at the corner.,1,TR3ST5,93533412,CPA,"Entrance, front door, left",99E,,Front left door entrance protective foil starting to peel up at the corner.,1
RWD,Serie,14-Oct-22,Front left door entrance protective foil starting to peel up at the corner.,1,TR3ST5,93532810,CPA,"Entrance, front door, left",99E,,Front left door entrance protective foil starting to peel up at the corner.,1
RWD,Serie,27-Sep-22,Wooden floor damaged near rear right wheel well.,1,TR1ST3,93538650,CPA,"Wooden floor, rear, cargo area",991,,Wooden floor damaged near rear right wheel well.,1
RWD,Serie,14-Sep-22,Paint chip on lower rear right sidewall near sliding door.,1,TR3ST2,93517449,CPA,"Sidewall, right",K8R,,Paint chip on lower rear right sidewall near sliding door.,1
RWD,Serie,14-Sep-22,Front right seat cushion foam is exposed when seat is laid back.,1,Supply,93515765,CPA,"Seat cushion, front seat, right",99E,,Front right seat cushion foam is exposed when seat is laid back.,1
RWD,Serie,1-Nov-22,Tabs not installed properly at top left rear entrance.,1,Supply,93560365,CPA,Rear entrance,991,,Tabs not installed properly at top left rear entrance.,1
RWD,Serie,1-Nov-22,Adhesive residue on rear inside right sidewall.,1,Z2SINNRH,93560365,CPA,"Sidewall, right, inner",B1R,,Adhesive residue on rear inside right sidewall.,1
RWD,Serie,28-Oct-22,Surface damage on lower right side of front bumper.,1,CHAST6,93536233,CPA,Front bumper,991,,Surface damage on lower right side of front bumper.,1
RWD,Serie,12-Oct-22,Sound dampener damaged in cargo area at the top.,1,SEAM06,93536589,CPA,"Rear section, soundproofing",991,,Sound dampener damaged in cargo area at the top.,1
RWD,Serie,12-Oct-22,Dent on bottom outside left door.,1,PDRBIW,93536589,CPA,"Front door, left",I1,,Dent on bottom outside left door.,1
RWD,Serie,12-Oct-22,Bottom of front right triangle window seal not installed properly.,1,FDPA1,93548279,CPA,"Sealing frame/bonding, triangular side window, A-pillar, right",42V,,Bottom of front right triangle window seal not installed properly.,1
RWD,Serie,26-Sep-22,Paint chip at right edge of engine hood.,1,FINST1,93515393,CPA,Engine hood,K8R,,Paint chip at right edge of engine hood.,1
RWD,Serie,26-Sep-22,Dent on left sidewall by taillight.,1,Z2SOUTLH,93538288,CPA,"Sidewall, left",I2,,Dent on left sidewall by taillight.,1
RWD,Serie,26-Sep-22,Rubber weather strip on cargo floor by sliding door entrance not installed correctly.,1,TR1ST3,93538288,CPA,Cargo area floor,42V,,Rubber weather strip on cargo floor by sliding door entrance not installed correctly.,1
RWD,Serie,13-Sep-22,Dent on bottom rear inside right D-pillar.,1,TR1ST3,93515120,CPA,D-pillar,I2,,Dent on bottom rear inside right D-pillar.,1
RWD,Serie,13-Sep-22,Front right floor mat has minor damage.,1,TR4ST7,93515120,CPA,"Floor mat, front, right",991,,Front right floor mat has minor damage.,1
RWD,Serie,13-Sep-22,Weld splatter on rear inside right wheel well.,1,Z1UNDT1,93515120,CPA,"Wheel well, rear, right",423,,Weld splatter on rear inside right wheel well.,1
RWD,Serie,13-Sep-22,Top of rear left door leak coming from behind apex seal.,1,TR1ST1,93508943,CPA,"Rear-end door, left, inside",04,,Top of rear left door leak coming from behind apex seal.,1
RWD,Serie,13-Sep-22,Front left door entrance protective foil starting to peel up at the corner.,1,TR3ST5,93508943,CPA,"Entrance, front door, left",99E,,Front left door entrance protective foil starting to peel up at the corner.,1
RWD,Serie,13-Sep-22,Engine EVAP hose loose.,1,CHAST5,93514503,CPA,Engine compartment,38,,Engine EVAP hose loose.,1
RWD,Serie,24-Sep-22,Cargo area wireway cover on left sidewall not installed properly.,1,TR3ST1,93530475,CPA,Trunk/cargo area,42V,,Cargo area wireway cover on left sidewall not installed properly.,1
RWD,Serie,28-Oct-22,Engine hood release cable not clipped to fem properly.,1,CHAST6,93555647,CPA,Engine hood cable - engine hood catch,38,,Engine hood release cable not clipped to fem properly.,1
RWD,Serie,28-Oct-22,Top of rear left door leak coming from behind apex seal.,1,TR1ST1,93555647,CPA,"Rear-end door, left, inside",04,,Top of rear left door leak coming from behind apex seal.,1
RWD,Serie,28-Oct-22,Front right door seal wavy along A-Pillar trim.,1,EVS,93555647,CPA,"Sealing frame, front door, right",I6,,Front right door seal wavy along A-Pillar trim.,1
RWD,Serie,28-Oct-22,Right side cargo sidewall panel damaged.,1,TR3ST1,93555647,CPA,"Panel, sidewall, right",991,,Right side cargo sidewall panel damaged.,1
RWD,Serie,27-Oct-22,Dent on bottom left sidewall near taillight and protective strip.,1,Z2SCOMLH,93564987,CPA,"Sidewall, left",I2,,Dent on bottom left sidewall near taillight and protective strip.,1
RWD,Serie,24-Sep-22,Paint chip on inner left B-pillar near abutting wedge.,1,TR4ST9,93522316,CPA,"B-pillar, left, inner",K8R,,Paint chip on inner left B-pillar near abutting wedge.,1
RWD,Serie,12-Sep-22,Inner sliding door leak coming in from behind lower panel.,1,SDPA,93508166,CPA,"Sliding door, right, inner",04,,Inner sliding door leak coming in from behind lower panel.,1
RWD,Serie,27-Oct-22,Left side cargo wall dented.,1,Z2SINNLH,93547933,CPA,"Sidewall, left, inner",I2,,Left side cargo wall dented.,1
RWD,Serie,10-Oct-22,White paint on bottom rear left door hinge.,1,FINST3,93536761,CPA,"Hinge, left, lower, rear-end door/liftgate",99E,,White paint on bottom rear left door hinge.,1
RWD,Serie,13-Dec-22,Rubber seal around engine compartment not positioned properly.,1,TR3ST4,93608339,CPA,"Seal, engine hood",61G,,Rubber seal around engine compartment not positioned properly.,1
RWD,Serie,15-Nov-22,Outer rear right sidewall dent.,1,Z2SCOMRH,93585693,CPA,"Sidewall, right",I1,,Outer rear right sidewall dent.,1
RWD,Serie,15-Nov-22,Front right side of center floor mat not installed properly against seat box.,1,TR4ST7,93585693,CPA,"Floor mat, front, right",42V,,Front right side of center floor mat not installed properly against seat box.,1
RWD,Serie,15-Nov-22,"Left side of battery box cover, information label is wrinkled.",1,TR4ST8,93583664,CPA,Information label battery,I7,,"Left side of battery box cover, information label is wrinkled.",1
RWD,Serie,15-Nov-22,Paint chip on front side of driver seat box.,1,TR4ST8,93582724,CPA,"Seat base, front seat, left",K8R,,Paint chip on front side of driver seat box.,1
RWD,Serie,8-Dec-22,Clip damaged on right sidewall protective strip at the C-Pillar.,1,TR4ST6,93617223,CPA,"Protective strip, sidewall, right",996,,Clip damaged on right sidewall protective strip at the C-Pillar.,1
RWD,Serie,7-Dec-22,Front left door entrance protective foil starting to peel up at the corner.,1,TR3ST5,93612075,CPA,"Entrance, front door, left",99E,,Front left door entrance protective foil starting to peel up at the corner.,1
RWD,Serie,14-Nov-22,Dent out on right sidewall by sliding door.,1,Z2SOUTRH,93580587,CPA,"Sidewall, right",I1,,Dent out on right sidewall by sliding door.,1
RWD,Serie,14-Nov-22,Rear brake line not secured in clip on underbody.,1,TR2ST7,93580587,CPA,Brake line rear (hydraulics),C77,,Rear brake line not secured in clip on underbody.,1
RWD,Serie,8-Mar-23,Windshield washer fluid hose not secured in engine compartment.,1,TR2ST4,93664175,CPA,"Hose, windshield washing system",C77,,Windshield washer fluid hose not secured in engine compartment.,1
RWD,Serie,3-Feb-23,Waviness in the paint on front left seat box.,1,BCCOAT,93624187,CPA,"Paint, seat base, front seat, left",I6,,Waviness in the paint on front left seat box.,1
RWD,Serie,3-Dec-22,Front left and right grill trim not clipped in properly.,1,RWKST1,93600088,CPA,"Trim piece, radiator grille",C77,,Front left and right grill trim not clipped in properly.,1
RWD,Serie,3-Dec-22,Screw on the rear trailer hitch is not flush.,1,TR5ST1,93600088,CPA,Trailer hitch,C77,,Screw on the rear trailer hitch is not flush.,1
RWD,Serie,3-Dec-22,Leak at left sidewall.,1,TR4ST6,93598175,CPA,"Sidewall, left",04,,Leak at left sidewall.,1
RWD,Serie,8-Mar-23,Front outer left air vent not installed correctly.  Vent not in correct orientation when adjustment wheel is completely opened or closed.,1,PACST4,93664175,CPA,"Air vent, front, outer, left",42V,,Front outer left air vent not installed correctly.  Vent not in correct orientation when adjustment wheel is completely opened or closed.,1
RWD,Serie,3-Feb-23,Rear door entrance seal and D-pillar trim gap too large.,1,TR4ST7,93624187,CPA,"Trim, D-pillar",61G,,Rear door entrance seal and D-pillar trim gap too large.,1
RWD,Serie,1-Dec-22,Front right door seal wavy along A-Pillar trim.,1,EVS,93592954,CPA,"Sealing frame, front door, right",I6,,Front right door seal wavy along A-Pillar trim.,1
RWD,Serie,17-Feb-23,Right side of automatic air conditioning unit not clipped in.,1,PACST3,93633287,CPA,"Operating unit, automatic air conditioning",C77,,Right side of automatic air conditioning unit not clipped in.,1
RWD,Serie,31-Jan-23,In-dent on inside left side C-pillar.,1,Z2SINNLH,93635233,CPA,"C-pillar, left, inner",I2,,In-dent on inside left side C-pillar.,1
RWD,Serie,31-Jan-23,Support bracket on inner right sidewall dented out.,1,Z2SINNRH,93635233,CPA,"Sidewall, right, inner",I1,,Support bracket on inner right sidewall dented out.,1
RWD,Serie,31-Jan-23,,1,FINST3,93635233,CPA,"Sidewall, right, inner",K7D,,,1
RWD,Serie,31-Jan-23,Right side of front bumper damaged at headlight and fender.,1,CHAST6,93603397,CPA,Front bumper,991,,Right side of front bumper damaged at headlight and fender.,1
RWD,Serie,30-Nov-22,Rivets on bottom front right door panel not flush.,1,FDPA3,93605947,CPA,"Door trim, front door, right",99E,,Rivets on bottom front right door panel not flush.,1
RWD,Serie,30-Nov-22,Front left door entrance protective foil starting to peel up at the corner.,1,TR3ST5,93596914,CPA,"Entrance, front door, left",99E,,Front left door entrance protective foil starting to peel up at the corner.,1
RWD,Serie,30-Jan-23,Rear LED cargo lights rivets not removed.,1,TR3ST6,93632925,CPA,Interior lamp,99E,,Rear LED cargo lights rivets not removed.,1
RWD,Serie,15-Feb-23,ECU connector locking clip not secured.,1,CHAST4,93642320,CPA,Engine harness,38,,ECU connector locking clip not secured.,1
RWD,Serie,15-Feb-23,Dent in on lower front left door.,1,Z3DMOUN,93642320,CPA,"Front door, left",I2,,Dent in on lower front left door.,1
RWD,Serie,22-Nov-22,Rear of front right seat box has excessive PVC at the bottom.,1,SEAM05,93588291,CPA,"Seat base, front seat, right",B1R,,Rear of front right seat box has excessive PVC at the bottom.,1
RWD,Serie,22-Nov-22,Windshield washer fluid hose not secured in engine compartment.,1,TR2ST4,93588291,CPA,"Hose, windshield washing system",C77,,Windshield washer fluid hose not secured in engine compartment.,1
RWD,Serie,2-Mar-23,Front right door window guide seal not installed properly.,1,FDPA3,93660017,CPA,"Window guide seal, front door, right",42V,,Front right door window guide seal not installed properly.,1
RWD,Serie,22-Nov-22,Front right door seal wavy along A-Pillar trim.,1,EVS,93591212,CPA,"Sealing frame, front door, right",I6,,Front right door seal wavy along A-Pillar trim.,1
RWD,Serie,21-Nov-22,Dent out on right sidewall by sliding door.,1,Z2SCOMRH,93592319,CPA,"Sidewall, right",I1,,Dent out on right sidewall by sliding door.,1
RWD,Serie,25-Jan-23,Cargo floor at the sliding door entrance has paint on it.,1,TR1ST3,93629749,CPA,Cargo area floor,99E,,Cargo floor at the sliding door entrance has paint on it.,1
RWD,Serie,23-Jan-23,Right side front wheel well missing a pushpin.,1,CHAST9,93621738,CPA,"Wheel well, front, right",C7,,Right side front wheel well missing a pushpin.,1
RWD,Serie,23-Jan-23,Rear LED cargo lights rivets not removed.,1,TR3ST6,93634855,CPA,Interior lamp,99E,,Rear LED cargo lights rivets not removed.,1
RWD,Serie,19-Nov-22,Dent on rear outside right sidewall.,1,Z2SOUTRH,93589018,CPA,"Sidewall, right",I2,,Dent on rear outside right sidewall.,1
RWD,Serie,19-Nov-22,Front inside left parking brake wire not wrapped fully or positioned under floor mat properly.,1,TR3ST3,93589018,CPA,Parking brake,99E,,Front inside left parking brake wire not wrapped fully or positioned under floor mat properly.,1
RWD,Serie,19-Nov-22,Fault on bottom left edge of rear right door.,1,Z3REDOOR,93589018,CPA,"Rear-end door, right",99E,,Fault on bottom left edge of rear right door.,1
RWD,Serie,21-Nov-22,Dent in on upper rear left and rear right door.,1,Z3REDOOR,93589059,CPA,"Rear-end door, left",I2,,Dent in on upper rear left and rear right door.,1
RWD,Serie,19-Nov-22,Top rear corner of middle sliding door trim damaged.,1,SDPA,93587251,CPA,"Door trim, sliding door, right",991,,Top rear corner of middle sliding door trim damaged.,1
RWD,Serie,28-Feb-23,Screw cover missing on inside grab handle of left front door panel.,1,FDPA3,93652279,CPA,"Cover, door trim, front door, left",C7,,Screw cover missing on inside grab handle of left front door panel.,1
RWD,Serie,9-Feb-23,Dent in on the outside right rear door.,1,Z3REDOOR,93631232,CPA,"Rear-end door, right",I2,,Dent in on the outside right rear door.,1
RWD,Serie,9-Feb-23,Inner sliding door VA3 panel damaged.,1,SDPA,93631232,CPA,"Sliding door, right, inner",991,,Inner sliding door VA3 panel damaged.,1
RWD,Serie,19-Jan-23,Inner sliding door leak coming in from behind lower panel.,1,SDPA,93612448,CPA,"Sliding door, right, inner",04,,Inner sliding door leak coming in from behind lower panel.,1
RWD,Serie,19-Jan-23,Lower door lock screws on inside of left rear door not touched up after door adjustment.,1,FINST3,93612414,CPA,"Rear-end door, left, inside",99E,,Lower door lock screws on inside of left rear door not touched up after door adjustment.,1
RWD,Serie,17-Nov-22,Rework visible around screws for fuel door,1,TR2ST1,93579415,CPA,Fuel filler flap,K7D,,Rework visible around screws for fuel door,1
RWD,Serie,18-Nov-22,Windshield washer fluid hose not secured in engine compartment.,1,TR2ST4,93572881,CPA,"Hose, windshield washing system",C77,,Windshield washer fluid hose not secured in engine compartment.,1
RWD,Serie,18-Jan-23,Rear axle vent tube not connected to rear axle.,1,CHAST9,93612471,CPA,"Vent line, rear axle housing",582,,Rear axle vent tube not connected to rear axle.,1
RWD,Serie,14-Dec-22,Paint chip on inner right A-pillar.,1,TR4ST9,93623528,CPA,"A-pillar, right, inner",K8R,,Paint chip on inner right A-pillar.,1
RWD,Serie,14-Dec-22,Excessive PVC on cargo floor at sliding door entrance.,1,SEAM05,93607380,CPA,Cargo area floor,K7N,,Excessive PVC on cargo floor at sliding door entrance.,1
RWD,Serie,14-Dec-22,Rear inside right sliding door panel damaged at the edge.,1,TR3ST2,93607380,CPA,"Sliding door, right, inner",991,,Rear inside right sliding door panel damaged at the edge.,1
RWD,Serie,14-Dec-22,Lower door lock screws on inside of left rear door not touched up after door adjustment.,1,FINST3,93622199,CPA,"Rear-end door, left, inside",99E,,Lower door lock screws on inside of left rear door not touched up after door adjustment.,1
RWD,Serie,13-Dec-22,Rivets on bottom front right door panel not flush.,1,FDPA3,93620920,CPA,"Door trim, front door, right",99E,,Rivets on bottom front right door panel not flush.,1
RWD,Serie,16-Nov-22,Dent in on rear right sidewall near tailight.,1,Z2SOUTRH,93598357,CPA,"Sidewall, right",I2,,Dent in on rear right sidewall near tailight.,1
RWD,Serie,16-Nov-22,Left side cargo wall dented.,1,Z2SINNLH,93589968,CPA,"Sidewall, left, inner",I2,,Left side cargo wall dented.,1
RWD,Serie,24-Aug-22,Excessive anti-flutter material/glue on right side cargo wall.,1,Z2SINNRH,93492015,CPA,"Sidewall, right, inner",B1R,,Excessive anti-flutter material/glue on right side cargo wall.,1
RWD,Serie,24-Aug-22,Bottom of left triangular side window seal wavy.,1,FDPA1,93489326,CPA,"Sealing frame/bonding, triangular side window, A-pillar, left",I6,,Bottom of left triangular side window seal wavy.,1
RWD,Serie,8-Sep-22,Front left door entrance protective foil starting to peel up at the corner.,1,TR3ST5,93508422,CPA,"Entrance, front door, left",99E,,Front left door entrance protective foil starting to peel up at the corner.,1
RWD,Serie,8-Sep-22,Top of rear left door leak coming from behind apex seal.,1,TR1ST1,93508422,CPA,"Rear-end door, left, inside",04,,Top of rear left door leak coming from behind apex seal.,1
RWD,Serie,23-Aug-22,Right side sun visor making contact with shelf when lowering and raising sun visor.  Contact also causes noise when moving sun visor.,1,TR3ST7,93494664,CPA,Sun visor right,221,,Right side sun visor making contact with shelf when lowering and raising sun visor.  Contact also causes noise when moving sun visor.,1
RWD,Serie,23-Aug-22,Front left sidewall sound dampener damaged.,1,SEAM06,93485233,CPA,"Soundproofing, left, trunk/cargo area",991,,Front left sidewall sound dampener damaged.,1
RWD,Serie,2-Sep-22,Bottom of left triangular side window seal wavy.,1,FDPA1,93504074,CPA,"Sealing frame/bonding, triangular side window, A-pillar, left",I6,,Bottom of left triangular side window seal wavy.,1
RWD,Serie,1-Sep-22,Engine EVAP hose loose.,1,CHAST5,93501906,CPA,Engine compartment,38,,Engine EVAP hose loose.,1
RWD,Serie,1-Sep-22,Inner sliding door panel damaged.,1,TR3ST2,93501906,CPA,"Sliding door, right, inner",991,,Inner sliding door panel damaged.,1
RWD,Serie,19-Aug-22,Top left rear entrance has excessive adhesive residue.,1,Z3UPP01,93496198,CPA,Rear entrance,B1R,,Top left rear entrance has excessive adhesive residue.,1
RWD,Serie,30-Aug-22,Dent in on right sidewall near sliding door and protective strip.,1,Z2SOUTRH,93495174,CPA,"Sidewall, right",I2,,Dent in on right sidewall near sliding door and protective strip.,1
RWD,Serie,29-Aug-22,Sealant around cargo area roof windows not tooled properly.,1,Z2BPASSY,93493823,CPA,"Window, roof",76B,,Sealant around cargo area roof windows not tooled properly.,1
